{
  "$schema": "http://json-schema.org/draft-07/schema#",
  "title": "GameStats",
  "type": "object",
  "required": ["game_id", "winner"],
  "properties": {
    "game_id": {
      "type": "string",
      "description": "Unique game identifier"
    },
    "start_time": {
      "type": "string",
      "format": "date-time",
      "description": "Start date and time of the match"
    },
    "end_time": {
      "type": "string",
      "format": "date-time",
      "description": "End date and time of the match"
    },
    "winner": {
      "type": "string",
      "enum": ["player1", "player2", "Tie"],
      "description": "Winner of the match"
    }
  }
}