[
  {
    "game_id": "qW4pFw17AG",
    "winner": "player2",
    "start_time": "2025-05-12T09:56:25.577893Z",
    "end_time": "2025-05-12T09:58:50.197646Z"
  },
  {
    "game_id": "WooO4odINz",
    "winner": "player1",
    "start_time": "2025-05-12T10:25:29.939526Z",
    "end_time": "2025-05-12T10:27:24.160269Z"
  }
]